<?xml version="1.0" encoding="UTF-8"?>
<tns:osm-tag-definition-list xmlns:tns="http://www.example.org/osm-tag-definition-list" xmlns:xsi="http://www.w3.org/2001/XMLSchema-instance" xsi:schemaLocation="http://www.example.org/osm-tag-definition-list osm-tag-definition-list.xsd " version="1.0">

<!-- ************************************************************************   -->
<!-- Highway: sample for a tag with one defined label and localized strings     -->
<!-- for two locales                                                            -->
<!-- ************************************************************************   -->
<tns:osm-tag-definition key="highway" iconName="highway.png">
	<tns:displayName locale="en">Highway</tns:displayName>
	<tns:displayName locale="de">Wege</tns:displayName>
	<tns:description locale="en">The highway tag is the primary tag used for highways. It is often the only tag. There are conventions for its use in particular countries.</tns:description>
	<tns:description locale="de">Der highway-Tag ist die hauptsächlich genutzte Art und Weise um Straßen zu kennzeichnen</tns:description>
		
	<tns:label>
	 	<tns:value>motorway</tns:value>
	 	<tns:displayName locale="en">Motorway</tns:displayName>
	 	<tns:displayName locale="de">Autobahn</tns:displayName>
	 	<tns:description locale="en">A restricted access major divided highway, normally with 2 or more running lanes plus emergency hard shoulder. Equivalent to the Freeway, Autobahn, etc.. </tns:description>
	 	<tns:description locale="de">Straße mit baulich getrennten Fahrtrichtungen (i. A. Grünstreifen) und besonderen Nutzungsbeschränkungen. Typischerweise zwei Fahrspuren je Fahrtrichtung oder mehr und ein Standstreifen.</tns:description>	 	
	</tns:label>
	
</tns:osm-tag-definition>

<!-- ************************************************************************   -->
<!-- building: sample for a tag of type boolean                                 -->
<!-- ************************************************************************   -->
<tns:osm-tag-definition key="building" type="boolean">
</tns:osm-tag-definition>


</tns:osm-tag-definition-list>
